Question,Option1,Option2,Option3,Option4,CorrectOption
What is the difference between `INNER JOIN` and `OUTER JOIN`?,`INNER JOIN` returns rows that have matching values in both tables, `OUTER JOIN` returns all rows from one table and matched rows from the second table,"`INNER JOIN` returns all rows, `OUTER JOIN` only returns matching rows","`INNER JOIN` works with one table, `OUTER JOIN` works with multiple tables","`INNER JOIN` returns rows that have matching values in both tables, `OUTER JOIN` returns all rows from one table and matched rows from the second table"
What is normalization used for in an RDBMS?,To reduce redundancy and improve data integrity,To increase the size of the database,To improve the database's query performance,To divide a table into sub-tables,To reduce redundancy and improve data integrity
Which normal form ensures that no non-prime attribute is transitively dependent on a candidate key?,1NF,2NF,3NF,BCNF,3NF
What is the purpose of a **trigger** in an RDBMS?,"To automatically perform actions like insert, update, or delete based on certain conditions","To store large amounts of data","To speed up queries by creating an index","To handle concurrency issues","To automatically perform actions like insert, update, or delete based on certain conditions"
What is a **composite key** in an RDBMS?,A key made up of multiple columns to uniquely identify a row,A key that is automatically generated by the database,A key that refers to a primary key in another table,"A key with a unique value, but not composed of multiple columns",A key made up of multiple columns to uniquely identify a row
What is **denormalization** in an RDBMS?,The process of combining normalized tables into a single table for performance improvement,The process of separating a table into multiple smaller tables,The process of adding redundant data to improve query performance,The process of removing unnecessary indexes,The process of combining normalized tables into a single table for performance improvement
Which type of relationship does **Referential Integrity** enforce in an RDBMS?,It ensures that foreign keys in one table match primary keys in another table,It ensures that all tables in the database are normalized,It ensures that a table does not contain redundant data,It ensures that the schema of the database is consistent,It ensures that foreign keys in one table match primary keys in another table
What is the purpose of an **Index** in RDBMS?,To speed up data retrieval operations,To define relationships between tables,To enforce data integrity,To normalize the database,To speed up data retrieval operations
What is **sharding** in the context of database management?,The process of horizontally partitioning data across multiple databases or servers,The process of vertically partitioning data,The process of duplicating data for high availability,The process of merging multiple tables into one,The process of horizontally partitioning data across multiple databases or servers